data gatherer,Genus,Species,Family,Realm,Kingdom,Phylum,Class,Order,"maximum body size (SVL, HBL, cm)",Source for maximum body size,notes on body size (e.g. type of metric),Trophic position,Source/logic for trophic position,migratory?,source/logic for migration info,dispersal distance category,logic/source for dispersal distance,dispersal type (walking may need to be reworded to something that encaptures slithering),logic/source for dispersal type,cold season dormancy?,source/logic for cold season dormancy,notes for cold season dormancy,hot season dormancy?,source/logic for hot season dormancy,notes for hot season dormancy,highland specialist,source/logic for highland specialist,Pelagic habitat (for marine species),source/logic for pelagic habitat,notes,genus_species,limit_type
Sally,Carpiodes,cyprinus,Catostomidae,Freshwater,Animalia,Chordata,Actinopterygii,Cypriniformes,66,fishbase,,omnivore,fishbase,N,NA,NA,NA,swimming,NA,N,unheard of for fish,,N,unheard of for fish,,N,NA,demersal,,NA,Carpiodes_cyprinus,max
Sally,Pimephales,promelas,Cyprinidae,Freshwater,Animalia,Chordata,Actinopterygii,Cypriniformes,10.1,fishbase,,omnivore,fishbase,N,NA,NA,NA,swimming,NA,N,unheard of for fish,,N,unheard of for fish,,N,NA,demersal,,NA,Pimephales_promelas,max
Sally,Cyprinodon,macularius,Cyprinodontidae,Freshwater,Animalia,Chordata,Actinopterygii,Cyprinodontiformes,5,fishbase,,NA,fishbase,N,NA,NA,NA,swimming,NA,N,unheard of for fish,,N,unheard of for fish,,N,NA,benthopelagic,,NA,Cyprinodon_macularius,max
Sally,Floridichthys,carpio,Cyprinodontidae,Freshwater,Animalia,Chordata,Actinopterygii,Cyprinodontiformes,8,fishbase,,NA,fishbase,N,NA,NA,NA,swimming,NA,N,unheard of for fish,,N,unheard of for fish,,N,NA,benthopelagic,,NA,Floridichthys_carpio,max
Sally,Gambusia,yucatana,Poeciliidae,Freshwater,Animalia,Chordata,Actinopterygii,Cyprinodontiformes,5.5,fishbase,,NA,fishbase,N,NA,NA,NA,swimming,NA,N,unheard of for fish,,N,unheard of for fish,,N,NA,benthopelagic,,NA,Gambusia_yucatana,max
Sally,Poeciliopsis,occidentalis,Poeciliidae,Freshwater,Animalia,Chordata,Actinopterygii,Cyprinodontiformes,6,fishbase,,NA,fishbase,N,NA,NA,NA,swimming,NA,N,unheard of for fish,,N,unheard of for fish,,N,NA,benthopelagic,,NA,Poeciliopsis_occidentalis,"max, min"
Sally,Hypomesus,nipponensis,Osmeridae,Freshwater,Animalia,Chordata,Actinopterygii,Osmeriformes,17,fishbase,,NA,fishbase,Y,anadromous,NA,NA,swimming,NA,N,unheard of for fish,,N,unheard of for fish,,N,NA,pelagic,,NA,Hypomesus_nipponensis,"max, min"
Sally,Lepomis,gibbosus,Centrarchidae,Freshwater,Animalia,Chordata,Actinopterygii,Perciformes,40,fishbase,,carnivore,fishbase,Y,potamodromous,1-10km,freshwater and restricted by temperature,swimming,NA,N,unheard of for fish,,N,unheard of for fish,,N,NA,benthopelagic,,NA,Lepomis_gibbosus,"max, min"
Jenn,Oncorhynchus,tshawytscha,Salmonidae,Freshwater,Animalia,Chordata,Actinopterygii,Salmoniformes,150,fishbase,,carnivore,fishbase,yes,Anadromous (Fishbase),NA,NA,swimming,NA,no,unheard of for fish,,no,unheard of for fish,,NA,NA,benthopelagic,,NA,Oncorhynchus_tshawytscha,"max, min"
Jenn,Alosa,pseudoharengus,Cottidae,Freshwater,Animalia,Chordata,Actinopterygii,Scorpaeniformes,40,fishbase,,carnivore,fishbase,yes,Anadromous (Fishbase),NA,NA,swimming,NA,no,unheard of for fish,,no,unheard of for fish,,NA,NA,pelagic,,NA,Alosa_pseudoharengus,"max, min"
Jenn,Cottus,cognatus,Cottidae,Freshwater,Animalia,Chordata,Actinopterygii,Scorpaeniformes,12.1,fishbase,,omnivore,fishbase,no?,Anadromous? (Biology description on Fishbase),NA,NA,swimming,NA,no,unheard of for fish,,no,unheard of for fish,,NA,NA,demersal,,NA,Cottus_cognatus,"max, min"
Jenn,Ameiurus,melas,Ictaluridae,Freshwater,Animalia,Chordata,Actinopterygii,Siluriformes,66,fishbase,,omnivore,fishbase,no,NA,NA,NA,swimming,NA,no,unheard of for fish,,no,unheard of for fish,,NA,NA,demersal,,NA,Ameiurus_melas,max
Jenn,Ameiurus,natalis,Ictaluridae,Freshwater,Animalia,Chordata,Actinopterygii,Siluriformes,60,fishbase,,carnivore,fishbase,no,NA,NA,NA,swimming,NA,no,unheard of for fish,,no,unheard of for fish,,NA,NA,demersal,,NA,Ameiurus_natalis,max
Susana,Halozetes,belgicae,Ameronothridae,Intertidal,Animalia,Arthropoda,Arachnida,Acarina,0.07,Cannon and Schenker (1985) Brit Antarct Surv Bull 67: 1-5,Body size is mean length,herbivore,"Deere and Chown (2006) The American Naturalist 168: 630-644; Hawes et al. (2007). J. Exp. Biol. 210.; Feeds on lichens and/or algea.
593-601.",Non-migratory,taxa,0-1,oribatid mites have low dispersal ability generally - Stary and Block (1998) Journal of Natural History 32: 861-894,walking,mite,No,no info - based on taxa,,No,no info - based on taxa,,non-highland specialist,Mercer et al (2000) Polar Biology 23: 775-784,intertidal,,NA,Halozetes_belgicae,"max, min"
Jenn,Hemigrapsus,nudus,Varunidae,Intertidal,Animalia,Arthropoda,Malacostraca,Decapoda,0.1342,Oliver and Schmelter (2018),mean carapace width,omnivore,Yamada and Boulding (1998) Journal of Experimental Marine Biology and Ecology 220(2): 191-211,Non-migratory,"do migrate offshore seasonally, but would likely not affect realized range (Boddeke (1976) Netherlands Journal of Sea Research 10(1):103-130)",10-100,"minimum PLD in water column is 30 days, benthic crustacean with planktonic larvae - Kelly, R. P., & Palumbi, S. R. (2010). Genetic structure among 50 species of the northeastern Pacific rocky intertidal community. PloS one, 5(1), e8594.",pelagic development and crawling adults,"pelagic larval development - Lehto, J., Sulkin, S., Strom, S., & Johnson, D. (1998). Protists and detrital particles as prey for the first larval stage of the brachyuran crab, Hemigrapsus oregonensis. Journal of experimental marine biology and ecology, 230(2), 213-224.",No,no info - based on taxa,,No,no info - based on taxa,,non-highland specialist,intertidal,benthic,,NA,Hemigrapsus_nudus,"max, min"
Jenn,Pachygrapsus,marmoratus,Grapsidae,Intertidal,Animalia,Arthropoda,Malacostraca,Decapoda,2.9,Mehmet et al. (2014) Journal of the Marine Biological Association of the United Kingdom 94(7): 1441-1449,mean carapace width,omnivore,"Cannicci et al. (2002) Estuarine, Coastal and Shelf Science 54: 983–1001",Non-migratory,taxa,10-100,"PLD 1 month, benthic crustacean with planktonic larvae- Fratini, S., Ragionieri, L., Cutuli, G., Vannini, M., & Cannicci, S. (2013). Pattern of genetic isolation in the crab Pachygrapsus marmoratus within the Tuscan Archipelago (Mediterranean Sea). Marine Ecology Progress Series, 478, 173-183.",pelagic development,"pelagic larval development - Pires, R. F., Peliz, Á., Pan, M., & dos Santos, A. (2020). “There and back again”− How decapod megalopae find the way home: A modelling exercise for Pachygrapsus marmoratus. Progress in Oceanography, 102331.",No,no info - based on taxa,,No,no info - based on taxa,,non-highland specialist,intertidal,benthic,,NA,Pachygrapsus_marmoratus,max
Jenn,Petrolisthes,gracilis,Porcellanidae,Intertidal,Animalia,Arthropoda,Malacostraca,Decapoda,NA,NA,NA,omnivore,filter feeding - Gabaldon (1979) Crustaceana 36(1): 110-112,Non-migratory,taxa,10-100,"PLD in genus thought to be months, benthic crustacean with planktonic larvae - Toonen, R. J., & Grosberg, R. K. (2011). Causes of chaos: spatial and temporal genetic heterogeneity in the intertidal anomuran crab Petrolisthes cinctipes. Phylogeography and population genetics in crustacea, 2011, 75-107.",pelagic development and crawling adults,"pelagic planktotrophic development in genus - Toonen, R. J., & Grosberg, R. K. (2011). Causes of chaos: spatial and temporal genetic heterogeneity in the intertidal anomuran crab Petrolisthes cinctipes. Phylogeography and population genetics in crustacea, 2011, 75-107.",No,no info - based on taxa,,No,no info - based on taxa,,non-highland specialist,intertidal,benthic,,NA,Petrolisthes_gracilis,"max, min"
Jenn,Petrolisthes,hirtipes,Porcellanidae,Intertidal,Animalia,Arthropoda,Malacostraca,Decapoda,NA,NA,NA,omnivore,filter feeding - Gabaldon (1979) Crustaceana 36(1): 110-112,Non-migratory,taxa,10-100,"PLD in genus thought to be months, benthic crustacean with planktonic larvae- Toonen, R. J., & Grosberg, R. K. (2011). Causes of chaos: spatial and temporal genetic heterogeneity in the intertidal anomuran crab Petrolisthes cinctipes. Phylogeography and population genetics in crustacea, 2011, 75-107.",pelagic development and crawling adults,"pelagic planktotrophic development in genus - Toonen, R. J., & Grosberg, R. K. (2011). Causes of chaos: spatial and temporal genetic heterogeneity in the intertidal anomuran crab Petrolisthes cinctipes. Phylogeography and population genetics in crustacea, 2011, 75-107.",No,no info - based on taxa,,No,no info - based on taxa,,non-highland specialist,intertidal,demersal,,NA,Petrolisthes_hirtipes,"max, min"
Jenn,Gobius,cobitis,Gobiidae,Intertidal,Animalia,Chordata,Actinopterygii,Perciformes,14.1,fishbase,TL male/unsexed,omnivore,fishbase,Non-migratory,fishbase,10-100,"PLD 37-44 days, intertidal species with planktonic larvae - Gil, M. F., Gonçalves, E. J., Faria, C., Almada, V. C., Baptista, C., & Carreiro, H. (1997). Embryonic and larval development of the giant goby Gobius cobitis (Pisces: Gobiidae). Journal of Natural History, 31(5), 799-804.",pelagic development and swimming adults,pelagic larval stage - Gil et al. (1997) Journal of Natural History 31(5):799-804,No,unheard of for fish,,No,unheard of for fish,,non-highland specialist,intertidal,demersal,,NA,Gobius_cobitis,max
Jenn,Gobius,niger,Gobiidae,Intertidal,Animalia,Chordata,Actinopterygii,Perciformes,18,fishbase,TL male/unsexed,carnivore,fishbase,Non-migratory,Bouchereau and Guelorget (1997) Oceanologica Acta 21(3): 503-517,10-100,"PLD 1 month, intertidal species with planktonic larvae- Giovannotti, M., La Mesa, M., & Caputo, V. (2009). Life style and genetic variation in teleosts: the case of pelagic (Aphia minuta) and benthic (Gobius niger) gobies (Perciformes: Gobiidae). Marine biology, 156(3), 239-252.",pelagic development and swimming adults,"pelagic planktonic larval stage - Vaas, K. F., Vlasblom, A. G., & De Koeijer, P. (1975). Studies on the black goby (Gobius niger, Gobiidae, Pisces) in the Veerse Meer, SW Netherlands. Netherlands Journal of Sea Research, 9(1), 56-68.",No,unheard of for fish,,No,unheard of for fish,,non-highland specialist,intertidal,demersal,,NA,Gobius_niger,max
Sally,Periophthalmus,kalolo,Gobiidae,Intertidal,Animalia,Chordata,Actinopterygii,Perciformes,14.1,fishbase,TL male/unsexed,carnivore,fishbase,Non-migratory,fishbase,10-100,"PLD in genus 30-50 days, intertidal species with planktonic larvae - Ansari, A. A., Trivedi, S., Saggu, S., & Rehman, H. (2014). Mudskipper: A biological indicator for environmental monitoring and assessment of coastal waters. Journal of Entomology and Zoology Studies, 2(6), 22-33.",pelagic development and crawling adults,"guess, pelagic planktonic larval stage in genus - Ansari, A. A., Trivedi, S., Saggu, S., & Rehman, H. (2014). Mudskipper: A biological indicator for environmental monitoring and assessment of coastal waters. Journal of Entomology and Zoology Studies, 2(6), 22-33.",No,unheard of for fish,,No,unheard of for fish,,non-highland specialist,intertidal,reef-associated,,NA,Periophthalmus_kalolo,"max, min"
Jenn,Patiriella,brevispina,Asterinidae,Intertidal,Animalia,Echinodermata,Asteroidae,Valvatida,5.2,Dartnall (1969) Papers and Proceedings of the Royal Society of Tasmania 104: 73-77,"maximum length, indeterminate growth",omnivore,filter feeding,Non-migratory,taxa,1-10,"pelagic lecithotrophic larvae of unk duration - Foltz, D. W. (2003). Invertebrate species with nonpelagic larvae have elevated levels of nonsynonymous substitutions and reduced nucleotide diversities. Journal of molecular evolution, 57(6), 607-612.",pelagic development and crawling adults,"pelagic lecithotrophic larvae - Foltz, D. W. (2003). Invertebrate species with nonpelagic larvae have elevated levels of nonsynonymous substitutions and reduced nucleotide diversities. Journal of molecular evolution, 57(6), 607-612.",No,no info - based on taxa,,No,no info - based on taxa,,non-highland specialist,intertidal,benthic,,NA,Patiriella_brevispina,max
Jenn,Mytilus,edulis,Mytilidae,Intertidal,Animalia,Mollusca,Bivalvia,Mytiloida,4,Kautsky (1982) Marine Biology 68: 117–133 ,"maximum shell length, indeterminate growth",omnivore,filter feeding bivalve,Non-migratory,sessile,10-100,"larval stage 3-5 weeks, benthic species with planktonic larvae - also Coolen et al. (2020) Molecular Ecology 29(4): 686-703",pelagic development and sessile adults,"pelagic larval stage - Filgueira, R., Brown, M. S., Comeau, L. A., & Grant, J. (2015). Predicting the timing of the pediveliger stage of Mytilus edulis based on ocean temperature. Journal of Molluscan Studies, 81(2), 269-273.",No,unheard of for marine bivalves,,No,unheard of for marine bivalves,,non-highland specialist,intertidal,benthic,,NA,Mytilus_edulis,"max, min"
Jenn,Barbatia,pistachia,Arcidae,Intertidal,Animalia,Mollusca,Bivalvia,Pteriomorpha,4.482,Compton et al. (2008) Journal of Experimental Marine Biology and Ecology 361(2): 104-110 ,mean shell length,omnivore,filter feeding bivalve,Non-migratory,sessile,10-100,"planktonic larval stage in genus thought to be ~1 month, benthic species with planktonic larvae (Zeinalinpour et al. (2014) Tropical Zoology 37(3): 73-87)",pelagic development and sessile adults,planktonic larval stage in genus - Zeinalinpour et al. (2014) Tropical Zoology 37(3): 73-87,No,unheard of for marine bivalves,,No,unheard of for marine bivalves,,non-highland specialist,intertidal,benthic,,NA,Barbatia_pistachia,"max, min"
Jenn,Anodontia,bullula,Lucinidae,Intertidal,Animalia,Mollusca,Bivalvia,Veneroida,2.5,Meyer (2008) The Raffles Bulletin of Zoology 18: 41-45,NA,omnivore,filter feeding bivalve,Non-migratory,sessile,1-10,"PLD unknown, benthic species with planktonic larvae",pelagic development,Labarbera (1974) Journal of Paleontology 48(2): 256-277; planktonic larvae based on species in the same genus,No,unheard of for marine bivalves,,No,unheard of for marine bivalves,,non-highland specialist,intertidal,benthic,,NA,Anodontia_bullula,"max, min"
Jenn,Cerastoderma,edule,Cardiidae,Intertidal,Animalia,Mollusca,Bivalvia,Veneroida,1.82,Lehane and Davenport (2002) Journal of the Marine Biological Association of the United Kingdom 82(4): 615-619,mean shell length,omnivore,filter feeding bivalve,Non-migratory,sessile,10-100,"PLD 3-5 weeks - Malham et al. (2012)  Journal of the Marine Biological Association of the United Kingdom 92: 1563–1584; planktonic duration 3-5 weeks, benthic species, settle after 3 months https://hal.archives-ouvertes.fr/file/index/docid/581394/filename/Synthesis_on_biology_of_Europeen_cockle.pdf",pelagic development and sessile adults,Shelagh et al. (2012) Journal of the Marine Biological Association of the United Kingdom 92(7):1563-1577,No,unheard of for marine bivalves,,No,unheard of for marine bivalves,,non-highland specialist,intertidal,benthic,,NA,Cerastoderma_edule,"max, min"
Jenn,Divaricella,irpex,Lucinidae,Intertidal,Animalia,Mollusca,Bivalvia,Veneroida,1.388,Compton et al. (2008) Journal of Experimental Marine Biology and Ecology 361(2): 104-110,mean shell length,omnivore,filter feeding bivalve,Non-migratory,sessile,NA,no info,NA,no info,No,unheard of for marine bivalves,,No,unheard of for marine bivalves,,non-highland specialist,intertidal,benthic,,NA,Divaricella_irpex,"max, min"
Jenn,Macoma,balthica,Tellinidae,Intertidal,Animalia,Mollusca,Bivalvia,Veneroida,2.5,Gilbert (1973) The Biological Bulletin 145(1): 119-126,NA,omnivore,filter feeding bivalve,Non-migratory,sessile,1-10,"PLD unknown, benthic  species with planktonic larvae - Van Colen, C., Lenoir, J., De Backer, A., Vanelslander, B., Vincx, M., Degraer, S., & Ysebaert, T. (2009). Settlement of Macoma balthica larvae in response to benthic diatom films. Marine Biology, 156(10), 2161-2171., Beukema and de Vlas (1989) Marine Ecology Progress Series 52: 193-200",pelagic development and sessile adults,Beukema and de Vlas (1989) Marine Ecology Progress Series 52: 193-200,No,unheard of for marine bivalves,,No,unheard of for marine bivalves,,non-highland specialist,intertidal,benthic,,NA,Macoma_balthica,"max, min"
Jenn,Mya,arenaria,Myidae,Intertidal,Animalia,Mollusca,Bivalvia,Veneroida,8,Gerasimova et al. (2016) Marine Research 70(1): 6 ,NA,omnivore,filter feeding bivalve,Non-migratory,sessile,10-100,Shanks (2009) The biological bulletin 216(3): 373-385,pelagic development and sessile adults,Brousseau (1978). Fish.Bull. 76(1): 155-166; planktonic larvae,No,unheard of for marine bivalves,,No,unheard of for marine bivalves,,non-highland specialist,intertidal,benthic,,NA,Mya_arenaria,max
Jenn,Spisula,subtruncata,Mactridae,Intertidal,Animalia,Mollusca,Bivalvia,Veneroida,NA,NA,NA,omnivore,filter feeding bivalve,Non-migratory,sessile,10-100,"PLD seems to be one month, benthic species with pelagic larvae - Cardoso et al. (2007)",pelagic development and sessile adults,Cardoso et al. (2007) Journal of Sea Research 57(4): 316-324; data suggest a larval settlement time of 1 month,No,unheard of for marine bivalves,,No,unheard of for marine bivalves,,non-highland specialist,intertidal,benthic,,NA,Spisula_subtruncata,max
Jenn,Tellina,tenuis,Tellinidae,Intertidal,Animalia,Mollusca,Bivalvia,Veneroida,2.6,"Dekker & Beukema (1999) Journal of Sea Research, 42(3): 207-220",NA,omnivore,filter feeding bivalve,Non-migratory,sessile,10-100,"PLD seems less than a month, benthic species with pelagic larvae- Barnett, P. R. (1985). The effect of temperature on the growth of planktonic larvae of Tellina tenuis da Costa. Journal of experimental marine biology and ecology, 89(1), 1-10.",pelagic development and sessile adults,"pelagic planktotrophic larval stage - Barnett, P. R. (1985). The effect of temperature on the growth of planktonic larvae of Tellina tenuis da Costa. Journal of experimental marine biology and ecology, 89(1), 1-10.",No,unheard of for marine bivalves,,No,unheard of for marine bivalves,,non-highland specialist,intertidal,benthic,,NA,Tellina_tenuis,max
Jenn,Nacella,concinna,Patellidae,Intertidal,Animalia,Mollusca,Gastropoda,Archaeogastropoda,6,sealifebase,NA,omnivore,"Kim (2001) ""Seasonality of marine algae and grazers of an Antarctic rocky intertidal, with emphasis On the role of the limpet Nacella concinna Strebel (Gastropoda: Patellidae)""",Non-migratory,taxa,10-100,"PLD 1 month, benthic species with planktonic larvae - Picken, G. B. (1980). The distribution, growth, and reproduction of the Antarctic limpet Nacella (Patinigera) concinna (Strebel, 1908). Journal of experimental marine biology and ecology, 42(1), 71-85.",pelagic development and crawling adults,"pelagic larval stage - Picken, G. B. (1980). The distribution, growth, and reproduction of the Antarctic limpet Nacella (Patinigera) concinna (Strebel, 1908). Journal of experimental marine biology and ecology, 42(1), 71-85.",No,unheard of for marine gastropods,,No,unheard of for marine gastropods,,non-highland specialist,intertidal,benthic,,NA,Nacella_concinna,"max, min"
Jenn,Nucella,lapillus,Muricidae,Intertidal,Animalia,Mollusca,Gastropoda,Archaeogastropoda,4.2,sealifebase,NA,carnivore,Vasileios and Andrews (2000) Malacologia 42(1-2): 103-112,Non-migratory,taxa,10-100,Colson and Hughes (2004) Molecular Ecology 13(8): 2223-2233,pelagic development,Colson and Hughes (2004) Molecular Ecology 13(8): 2223-2233,No,unheard of for marine gastropods,,No,unheard of for marine gastropods,,non-highland specialist,intertidal,benthic,,NA,Nucella_lapillus,"max, min"
Jenn,Littorina,littorea,Littorinidae,Intertidal,Animalia,Mollusca,Gastropoda,Neotaenioglossa,4.2,sealifebase,NA,herbivore,Imrie et al. (1989) Journal of Molluscan Studies 55(2): 217–225,Non-migratory,taxa,10-100,Shanks et al. (2003) Ecological Applications 13(1): 159–169,pelagic development and crawling adults,Johannesson (1988) Marine Biology 99: 507-513,No,unheard of for marine gastropods,,No,unheard of for marine gastropods,,non-highland specialist,intertidal,benthic,,NA,Littorina_littorea,"max, min"
Jenn,Littorina,obtusata,Littorinidae,Intertidal,Animalia,Mollusca,Gastropoda,Neotaenioglossa,1.3,sealifebase,NA,herbivore,Coleman et al. (2007) Oecologia 151(3): 454-463,Non-migratory,taxa,10-100,Ingolfsson (1995) Marine Biology 122: 13-21; rafting on seaweed,non-pelagic development and crawling adults,Mileikovsky (1975) Marine Biology 30: 129-135; direct development,No,unheard of for marine gastropods,,No,unheard of for marine gastropods,,non-highland specialist,intertidal,benthic,,NA,Littorina_obtusata,"max, min"
Jenn,Littorina,saxatilis,Littorinidae,Intertidal,Animalia,Mollusca,Gastropoda,Neotaenioglossa,1.9,sealifebase,NA,herbivore,Shumway et al. (1993) 106(2): 391-395,Non-migratory,taxa,10-100,Ingolfsson (1995) Marine Biology 122: 13-21; rafting on seaweed,non-pelagic development and crawling adults,Mileikovsky (1975) Marine Biology 30: 129-135; viviparity,No,unheard of for marine gastropods,,No,unheard of for marine gastropods,,non-highland specialist,intertidal,benthic,,NA,Littorina_saxatilis,"max, min"
Jenn,Ischnochiton,australis,Ischnochitonidae,Intertidal,Animalia,Mollusca,Polyplaclophora,Chitonida,NA,NA,NA,herbivore,Sigwart and Schwabe (2017) Invertebrate Zoology 14(2): 205–216,Non-migratory,taxa,1-10,"PLD hours to days, lecithotrophic larvae - Palmer (2011) Austral Ecology 37(1): 110-124",pelagic development,Palmer (2011) Austral Ecology 37(1): 110-124,No,no info - based on taxa,,No,no info - based on taxa,,non-highland specialist,intertidal,benthic,,NA,Ischnochiton_australis,max
Jenn,Crangon,crangon,Crangonidae,Marine,Animalia,Arthropoda,Malacostraca,Decapoda,8.9,sealifebase,TL male/unsexed,carnivore,sealifebase,Non-migratory,taxa,10-100,http://www.marlin.ac.uk/biotic/browse.php?sp=4599,pelagic development,planktotrophic larvae - http://www.marlin.ac.uk/biotic/browse.php?sp=4599,NA,NA,,No,no info,,non-highland specialist,marine,benthic,sealifebase,NA,Crangon_crangon,max
Jenn,Liocarcinus,marmoreus,Portunidae,Marine,Animalia,Arthropoda,Malacostraca,Decapoda,3,Robinson et al. (2010) Journal of the Marine Biological Association of the United Kingdom 90(1): 95-104,CW maximum,carnivore,EOL,Non-migratory,taxa,10-100,"PLD unk, benthic crustacean with planktonic larvae",pelagic development,"larval pelagic phase - Giomi, F., Raicevich, S., Ferrarese, A., Pranovi, F., Di Muro, P., & Beltramini, M. (2007). Structural and functional heterogeneity of hemocyanin: intra-and inter-specific comparison in four species of portunid crabs (Crustacea: Portunidae). Marine biology, 151(4), 1237-1247.",NA,NA,,No,no info,,non-highland specialist,marine,benthic,EOL,NA,Liocarcinus_marmoreus,max
Jenn,Metacarcinus,magister,Cancridae,Marine,Animalia,Arthropoda,Malacostraca,Decapoda,22.5,sealifebase,CW male/unsexed,omnivore,Yamada et al. (2010) Journal of Shellfish Research 29(2):471-477,Non-migratory,taxa,10-100,"PLD 80 days, benthic crustacean with planktonic larvae - Rasmuson, L. K. (2013). The biology, ecology and fishery of the Dungeness crab, Cancer magister. In Advances in marine biology (Vol. 65, pp. 95-148). Academic Press.",pelagic development,"planktonic larval stage - Rasmuson, L. K., & Shanks, A. L. (2020). Revisiting cross-shelf transport of Dungeness crab (Metacarcinus magister) megalopae by the internal tide using 16 years of daily abundance data. Journal of Experimental Marine Biology and Ecology, 527, 151334.",NA,NA,,No,no info,,non-highland specialist,marine,benthic,EOL,NA,Metacarcinus_magister,max
Jenn,Liothyrella,uva,Terebratulidae,Marine,Animalia,Brachiopoda,Articulata,Terebratulida,5,Peck and Holmes (1989) Journal of Experimental Marine Biology and Ecology 133(1–2):141-150,maximum shell length,omnivore,deposit feeder,Non-migratory,taxa,100+,"PLD 45 days, open ocean species with planktonic larvae- Peck, L. S., & Robinson, K. (1994). Pelagic larval development in the brooding Antarctic brachiopod Liothyrella uva. Marine Biology, 120(2), 279-286.; Barnes, D. K., & Peck, L. S. (1996). Epibiota and attachment substrata of deep-water brachiopods from Antarctica and New Zealand. Philosophical Transactions of the Royal Society of London. Series B: Biological Sciences, 351(1340), 677-687.",pelagic development,"planktonic larval stage - Peck, L. S., & Robinson, K. (1994). Pelagic larval development in the brooding Antarctic brachiopod Liothyrella uva. Marine Biology, 120(2), 279-286.",NA,NA,,No,no info,,non-highland specialist,marine,benthic,sealifebase,NA,Liothyrella_uva,max
Jenn,Liothyrella,neozelanica,Terebratulidae,Marine,Animalia,Brachiopoda,Rhynchonellata,Terebratulida,5,Baird et al. (2013) Biological Bulletin 25(3):125-36,,omnivore,deposit feeder,Non-migratory,taxa,0-1,"broods larvae - Chuang, S. H. (1994). Observations on the reproduction and development of Liothyrella neozelanica Thomson 1918 (Terebratulacea, Articulata, Brachiopoda). Journal of the Royal Society of New Zealand, 24(2), 209-218.",non-pelagic devepment and crawling adults,larval brooding ,NA,NA,,No,no info,,non-highland specialist,marine,benthic,sealifebase,NA,Liothyrella_neozelanica,max
Sally,Menidia,menidia,Atherinopsidae,Marine,Animalia,Chordata,Actinopterygii,Atheriniformes,15,fishbase,,carnivore,fishbase,Migratory,oceanodromous,10-100,migrates,migrating adults,migrates,No,unheard of for fish,,No,unheard of for fish,,non-highland specialist,marine,pelagic,NA,NA,Menidia_menidia,"max, min"
